<?xml version="1.0" encoding="UTF-8"?>
<hotel xmlns:xsi="http://www.w3.org/2001/XMLSchema-instance"
       xsi:noNamespaceSchemaLocation="hotel_reservas.xsd">
    <reservas>
        <reserva>
            <numero_reserva>RES001</numero_reserva>
            <hospede>
                <numero_cliente>CLI123</numero_cliente>
                <nome>João Silva</nome>
                <nif>123456789</nif>
                <email>joao.silva@email.com</email>
                <telefone>912345678</telefone>
            </hospede>
            <check_in>2026-02-10</check_in>
            <check_out>2026-02-15</check_out>
            <valor_total>750.00</valor_total>
            <unidade>LS</unidade>
            <servicos_adicionais>
                <servico>
                    <nome>Spa</nome>
                    <preco>50.00</preco>
                    <quantidade>2</quantidade>
                </servico>
                <servico>
                    <nome>Restaurante</nome>
                    <preco>30.00</preco>
                    <quantidade>3</quantidade>
                </servico>
            </servicos_adicionais>
        </reserva>
        
        <reserva>
            <numero_reserva>RES002</numero_reserva>
            <hospede>
                <numero_cliente>CLI456</numero_cliente>
                <nome>Maria Santos</nome>
                <nif>987654321</nif>
                <email>maria.santos@email.com</email>
                <telefone>923456789</telefone>
            </hospede>
            <check_in>2026-02-12</check_in>
            <check_out>2026-02-14</check_out>
            <valor_total>420.00</valor_total>
            <unidade>PO</unidade>
            <servicos_adicionais>
                <servico>
                    <nome>Transporte</nome>
                    <preco>25.00</preco>
                    <quantidade>1</quantidade>
                </servico>
            </servicos_adicionais>
        </reserva>
        
        <reserva>
            <numero_reserva>RES003</numero_reserva>
            <hospede>
                <numero_cliente>CLI123</numero_cliente>
                <nome>João Silva</nome>
                <nif>123456789</nif>
                <email>joao.silva@email.com</email>
                <telefone>912345678</telefone>
            </hospede>
            <check_in>2026-03-01</check_in>
            <check_out>2026-03-05</check_out>
            <valor_total>980.00</valor_total>
            <unidade>CB</unidade>
            <servicos_adicionais>
                <servico>
                    <nome>Spa</nome>
                    <preco>50.00</preco>
                    <quantidade>1</quantidade>
                </servico>
                <servico>
                    <nome>Restaurante</nome>
                    <preco>30.00</preco>
                    <quantidade>4</quantidade>
                </servico>
                <servico>
                    <nome>Transporte</nome>
                    <preco>25.00</preco>
                    <quantidade>2</quantidade>
                </servico>
            </servicos_adicionais>
        </reserva>
        
        <reserva>
            <numero_reserva>RES004</numero_reserva>
            <hospede>
                <numero_cliente>CLI789</numero_cliente>
                <nome>Pedro Costa</nome>
                <nif>456789123</nif>
                <email>pedro.costa@email.com</email>
                <telefone>934567890</telefone>
            </hospede>
            <check_in>2026-02-20</check_in>
            <check_out>2026-02-25</check_out>
            <valor_total>1200.00</valor_total>
            <unidade>FR</unidade>
            <servicos_adicionais>
                <servico>
                    <nome>Spa</nome>
                    <preco>50.00</preco>
                    <quantidade>3</quantidade>
                </servico>
                <servico>
                    <nome>Restaurante</nome>
                    <preco>30.00</preco>
                    <quantidade>5</quantidade>
                </servico>
                <servico>
                    <nome>Transporte</nome>
                    <preco>25.00</preco>
                    <quantidade>2</quantidade>
                </servico>
                <servico>
                    <nome>Lavandaria</nome>
                    <preco>15.00</preco>
                    <quantidade>1</quantidade>
                </servico>
            </servicos_adicionais>
        </reserva>
        
        <reserva>
            <numero_reserva>RES005</numero_reserva>
            <hospede>
                <numero_cliente>CLI456</numero_cliente>
                <nome>Maria Santos</nome>
                <nif>987654321</nif>
                <email>maria.santos@email.com</email>
                <telefone>923456789</telefone>
            </hospede>
            <check_in>2026-03-10</check_in>
            <check_out>2026-03-12</check_out>
            <valor_total>350.00</valor_total>
            <unidade>BR</unidade>
        </reserva>
        
        <reserva>
            <numero_reserva>RES006</numero_reserva>
            <hospede>
                <numero_cliente>CLI321</numero_cliente>
                <nome>Ana Ferreira</nome>
                <nif>321654987</nif>
                <email>ana.ferreira@email.com</email>
                <telefone>945678901</telefone>
            </hospede>
            <check_in>2026-02-15</check_in>
            <check_out>2026-02-18</check_out>
            <valor_total>580.00</valor_total>
            <unidade>LS</unidade>
            <servicos_adicionais>
                <servico>
                    <nome>Spa</nome>
                    <preco>50.00</preco>
                    <quantidade>2</quantidade>
                </servico>
                <servico>
                    <nome>Transporte</nome>
                    <preco>25.00</preco>
                    <quantidade>1</quantidade>
                </servico>
            </servicos_adicionais>
        </reserva>
        
        <reserva>
            <numero_reserva>RES007</numero_reserva>
            <hospede>
                <numero_cliente>CLI654</numero_cliente>
                <nome>Carlos Oliveira</nome>
                <nif>654987321</nif>
                <email>carlos.oliveira@email.com</email>
                <telefone>956789012</telefone>
            </hospede>
            <check_in>2026-03-05</check_in>
            <check_out>2026-03-08</check_out>
            <valor_total>640.00</valor_total>
            <unidade>PO</unidade>
            <servicos_adicionais>
                <servico>
                    <nome>Restaurante</nome>
                    <preco>30.00</preco>
                    <quantidade>4</quantidade>
                </servico>
            </servicos_adicionais>
        </reserva>
    </reservas>
</hotel>
